Thu_tu,Tieu_de,Thoi_gian_dang,Tom_tat,Noi_dung,Tom_tat_bai_bao
29,Ấm áp lễ hội linh,27 tháng 09 2019 15:17,"(CMO) Những ngày này, về nơi có đông đồng bào dân tộc sinh sống sẽ thấy không khí bà con chuẩn bị cho lễ hội Sene Dolta truyền thống. Năm nay, Sene Dolta diễn ra vào các ngày 29, 30 tháng 8 và 1 tháng 9 âm lịch.","Đây là ngày lễ lớn, được tổ chức nhằm tưởng nhớ đến công ơn ông bà, cha mẹ và người thân, tạ ơn những người đã khuất và cầu phước cho những người còn sống, tạo sự gắn bó giữa bạn bè, người thân và cả cộng đồng. Sene Dolta hay còn gọi là lễ hội linh diễn ra trong thời gian khi bà con đã xong việc đồng áng, là dịp để anh em, dòng họ ở xa được gặp nhau, tỏ lòng thành kính đến ông bà, cha mẹ. Trước khi ngày lễ diễn ra khoảng 1 tuần, bà con ở ấp Đường Đào, xã Hồ Thị Kỷ, huyện Thới Bình bắt đầu chuẩn bị các lễ vật để đi chùa, cánh đàn ông thì làm heo. Đây cũng là nguồn nguyên liệu để chế biến các món ăn cúng trong ngày lễ Sene Dolta. Tuỳ theo mỗi nhà sẽ ăn lễ lớn hoặc nhỏ (theo mùa màng), thịt heo được chia cho bà con trong xóm, mỗi người một ít, từ đây tình làng nghĩa xóm cũng bền chặt hơn. Ông Thạch Văn Sơn, ấp Đường Đào, xã Hồ Thị Kỷ, cho biết: “Thịt heo này dùng để kho, làm nhiều món lắm… cúng ông bà, đãi xóm giềng. Đời sống bà con ở đây ngày càng phát triển, ăn tết cũng thấy lớn hơn mọi năm”. Gia đình ở đây có gì làm nấy, từ con gà, vịt, heo… chia nhau ăn tết, có nhà gói bánh; Ở xóm làng thì những ngày lễ đi thăm viếng nhau, đặc biệt 4-5 giờ sáng phải đi chùa cầu nguyện, cầu siêu cho những vong linh đã mất. Đến ngày cuối của lễ, sau khi dâng cơm cúng dường tại chùa, bà con sẽ trở về nhà tổ chức cúng trước khi tiễn linh hồn người quá cố ra đi. Bà Thạch Son, ấp Đường Đào, xã Hồ Thị Kỷ, chia sẻ: “Năm nào tôi cũng đi chùa cầu nguyện, không chỉ những vong linh đã khuất, mình bưng mâm đồ cúng vô chùa nghe vị sư cả đọc kinh./. Phạm Nhật","Trước lễ diễn 1 tuần , ấp Đường Đào , xã Hồ Thị Kỷ , huyện Thới Bình bắt đầu chuẩn lễ vật đi chùa , cánh đàn heo . Gia đình , gà , vịt , heo… chia tết , gói bánh ; Ở xóm làng lễ đi thăm viếng , đặc biệt 4-5 đi chùa cầu nguyện , cầu siêu vong linh . Bà Thạch Son , ấp Đường Đào , xã Hồ Thị Kỷ , chia sẻ : “ Năm đi chùa cầu nguyện , vong linh khuất , bưng mâm đồ cúng vô chùa vị sư đọc kinh./ ."
30,Mùa lễ hội với nỗi lo an toàn thực phẩm,17 tháng 10 2018 14:00,"(CMO) Những tháng cuối năm là thời điểm diễn ra nhiều ngày. Ngoài việc mang lại không khí vui tươi cho người dân nơi đây và du khách là nỗi lo về các dịch vụ phục vụ nhu cầu ăn uống không đảm bảo, tiềm ẩn nguy cơ mất vệ sinh an toàn thực phẩm (ATTP).","Khi được hỏi về nỗi lo vệ sinh ATTP, nhiều thực khách tặc lưỡi cho qua. Bạn Lê Kim Ngân, sinh viên Trường Đại học Bình Dương, nói: “Đối với sinh viên tụi em, rẻ, ngon là được. Biết là không đảm bảo vệ sinh cho lắm nhưng lâu lâu tụi em ăn một lần chứ đâu phải ngày nào cũng ăn nên chắc không sao”. Do tính chất thời vụ, lượng khách đông, trong khi điều kiện đảm bảo chế biến, vệ sinh còn nhiều hạn chế nên vấn đề ATTP mùa lễ hội vẫn còn rất nhiều nỗi lo, tiềm ẩn nguy cơ mất vệ sinh. Qua công tác kiểm tra đột xuất cùng đoàn kiểm tra của Chi cục An toàn vệ sinh thực phẩm tỉnh tại một số điểm kinh doanh dịch vụ ăn uống trong khu vực diễn ra lễ hội, được biết, nhiều điểm thuê nhân lực thời vụ, chưa được tập huấn kiến thức ATTP, chưa được khám sức khoẻ... Bên cạnh những điểm kinh doanh ăn uống đã có đăng ký với chính quyền địa phương, được kiểm tra, vẫn còn tồn tại nhiều hàng quán tự phát, kinh doanh các loại thực phẩm ăn nhanh như chân gà nướng, vịt nướng, cá viên chiên, bánh mì, các loại trái cây gọt sẵn... phục vụ nhu cầu của người dân và du khách chưa được kiểm soát hết. Tuy đã có thay đổi theo hướng tích cực, nhưng theo ghi nhận tại một số lễ hội trước đó, công tác bảo đảm ATTP vẫn còn tồn tại như: Khu vực Phường 8, Công viên Hồng Bàng (Phường 5), Quảng trường (Phường 9), tình trạng bán thực phẩm chín lẫn với sống, nhếch nhác dọc hai bên đường nằm sát ngay đường giao thông, lượng người đi lại đông đúc, bụi bẩn, song nhiều loại thức ăn được chế biến sẵn hoặc chế biến tại chỗ không có kính tủ bảo quản, che đậy, người chế biến không đeo găng tay.... Nhiều điểm kinh doanh dịch vụ ăn uống tại đây chưa đăng ký kinh doanh, chưa có chứng nhận đủ điều kiện ATTP như không có tủ kính, không đeo găng tay, người bán hàng chưa khám sức khoẻ, chưa được tập huấn kiến thức ATTP... Một số thực khách không có ý thức, xả rác khu vực xung quanh, gây mất vệ sinh, mất mỹ quan; Các quán ăn thường được dựng đơn giản, tạm bợ, thiếu nước sạch... Ông Trần Bé Ngoan, Chi cục trưởng Chi cục An toàn vệ sinh thực phẩm tỉnh, cho biết, nhằm nỗ lực ngăn ngừa không để xảy ra tình trạng ngộ độc thực phẩm trong mùa lễ, Tết năm nay, Chi cục đã tổ chức các đoàn phối hợp với các phòng, trung tâm y tế địa phương kiểm tra, kết hợp hướng dẫn, tuyên truyền các cơ sở sản xuất, chế biến, kinh doanh thực phẩm phục vụ lễ hội đảm bảo các điều kiện ATTP. Trong đó, tập trung kiểm tra, giám sát các cơ sở cung cấp thực phẩm, chế biến phục vụ ăn uống, kiểm tra nguồn gốc xuất xứ, nguồn nước, dụng cụ, trang thiết bị, lưu mẫu thức ăn, điều kiện vệ sinh của nhân viên phục vụ... Bên cạnh đó, các đoàn cũng tổ chức lấy mẫu để kiểm tra, phân tích các yếu tố nguy cơ gây bệnh đường tiêu hoá, ngộ độc thực phẩm. Thiết nghĩ, để bảo đảm vệ sinh ATTP cho thức ăn đường phố, bảo đảm sức khoẻ cho cộng đồng, quan trọng nhất là ý thức tự giác, trách nhiệm và có đạo đức của mỗi người sản xuất, kinh doanh, chế biến thực phẩm. Cùng với đó, người tiêu dùng cần là người thông thái, tự trang bị cho mình và người thân những kiến thức vệ sinh ATTP, nói không với những quán ăn đường phố không đảm bảo các điều kiện vệ sinh. Đồng thời, các cơ quan chức năng cần quan tâm hơn nữa đến công tác quản lý cơ sở chế biến, kinh doanh thực phẩm trên địa bàn. Đồng thời, nâng cao ý thức người tiêu dùng trong việc lựa chọn các cơ sở uy tín; Thông báo cho cơ quan chức năng các cơ sở, đơn vị kinh doanh có dấu hiệu buôn bán, kinh doanh hàng hoá, chế biến sản phẩm kém chất lượng, tránh trường hợp đáng tiếc xảy ra./. Mỹ Mỹ","Qua công tác kiểm tra đột xuất đoàn kiểm tra Chi cục An toàn vệ sinh thực phẩm tỉnh kinh doanh dịch vụ uống khu vực diễn lễ hội , , thuê nhân lực thời vụ , tập huấn kiến thức ATTP , khám sức khoẻ ... Bên cạnh kinh doanh uống đăng ký quyền địa phương , kiểm tra , tồn hàng quán phát , kinh doanh thực phẩm chân gà nướng , vịt nướng , cá viên chiên , bánh mì , trái gọt sẵn ... phục vụ nhu cầu dân du kiểm soát . Tuy thay đổi hướng tích cực , ghi lễ hội , công tác bảo đảm ATTP tồn : Khu vực Phường 8 , Công viên Hồng Bàng ( Phường 5 ) , Quảng trường ( Phường 9 ) , tình trạng thực phẩm chín lẫn sống , nhếch nhác dọc hai đường nằm sát đường giao thông , đi đông đúc , bụi bẩn , song thức chế biến sẵn chế biến chỗ kính tủ bảo quản , che đậy , chế biến đeo găng .... Nhiều kinh doanh dịch vụ uống đăng ký kinh doanh , chứng kiện ATTP tủ kính , đeo găng , hàng khám sức khoẻ , tập huấn kiến thức ATTP ... Một thực thức , xả rác khu vực xung quanh , vệ sinh , mỹ quan ; Các quán dựng đơn giản , tạm bợ , sạch ... Ông Trần Bé Ngoan , Chi cục trưởng Chi cục An toàn vệ sinh thực phẩm tỉnh , , nỗ lực ngăn ngừa xảy tình trạng ngộ độc thực phẩm mùa lễ , Tết , Chi cục tổ chức đoàn phối hợp phòng , trung tâm y tế địa phương kiểm tra , kết hợp hướng , tuyên truyền sở sản xuất , chế biến , kinh doanh thực phẩm phục vụ lễ hội đảm bảo kiện ATTP . Trong , tập trung kiểm tra , giám sát sở cung thực phẩm , chế biến phục vụ uống , kiểm tra gốc xuất xứ , , dụng cụ , trang thiết , lưu mẫu thức , kiện vệ sinh nhân viên phục vụ ... Bên cạnh , đoàn tổ chức mẫu kiểm tra , phân tích yếu tố nguy bệnh đường tiêu hoá , ngộ độc thực phẩm ."
31,"Chấn chỉnh việc tổ chức các lễ hội, bảo tồn giá trị truyền thống",09 tháng 03 2017 14:10,"(CMO) Sáng 9/3, Ban Tuyên giáo Trung ương hội nghị trực tuyến báo cáo viên toàn quốc. Hội nghị dành phần lớn thời gian nêu lên thực trạng tổ chức các lễ hội của nước ta trong giai đoạn gần đây, đi sâu phân tích những bất cập, đề ra những giải pháp nhằm quản lý, bảo tồn và phát huy các giá trị lễ hội.","Theo đó, nước ta hiện nay có khoảng 8.000 lễ hội, gồm lễ hội dân gian, lễ hội lịch sử, lễ hội tôn giáo và các lễ hội du nhập từ nước ngoài. Việc tổ chức lễ hội nhiều lúc, nhiều nơi bị biến tướng, gây phản cảm và tạo nên dư luận xấu. Chính phủ, các bộ, ngành liên quan đã có những chỉ đạo kịp thời, sâu sát, từng bước chấn chỉnh các hiện tượng tiêu cực, kiên quyết loại bỏ những lễ hội tự phát, tư lợi. Riêng quá trình tái cơ cấu kinh tế nông nghiệp được xác định là tất yếu và cấp thiết để xây dựng một nền công nghiệp nông nghiệp mang lại giá trị kinh tế cao. Tái cơ cấu kinh tế phải gắn với xu thế phát triển của đất nước, của khu vực và thế giới; thích nghi với biến đổi khí hậu và nâng cao giá trị lợi nhuận của nông sản Việt Nam. Thời gian qua đã ghi nhận nhiều mô hình nông nghiệp với quy trình hiện đại, quy mô lớn, mang lại cho nông dân lợi nhuận cao và bền vững. Nông nghiệp vẫn là một lĩnh vực chiếm tỷ trọng lớn, do đó tái cơ cấu kinh tế nông nghiệp chính là tương lai và quyết định nội lực phát triển của đất nước. Quốc Rin","Theo , ta hiện 8.000 lễ hội , lễ hội dân gian , lễ hội lịch sử , lễ hội tôn giáo lễ hội du nhập . Riêng trình tái cấu kinh tế nông nghiệp xác định tất yếu thiết xây dựng công nghiệp nông nghiệp giá trị kinh tế . Nông nghiệp lĩnh vực chiếm tỷ trọng , tái cấu kinh tế nông nghiệp tương lai quyết định nội lực phát triển đất ."
32,Xây dựng lễ hội đặc trưng riêng cho từng địa phương,24 tháng 11 2020 14:16,"(CMO) “Mỗi một huyện, thành phố xây dựng kế hoạch tổ chức một lễ hội đặc trưng riêng từng vùng, tùy vào sự kiện trong năm để thu hút du khách đến Cà Mau trải nghiệm”. Đó là đề xuất của Chủ tịch UBND tỉnh Lê Quân tại Hội nghị “Phát triển du lịch Cà Mau” vào sáng ngày 24/11. Phó Chủ tịch UBND tỉnh Lê Văn Sử đồng chủ trì hội nghị.","Đề xuất đó được đông đảo các sở, ngành, địa phương, doanh nghiệp và công ty du lịch lữ hành trên địa bàn tỉnh tham dự nhiệt tình hưởng ứng. Theo đó, mỗi địa phương đưa ra thế mạnh riêng của mình. Từ phát triển du lịch sinh thái, gác kèo ong (U Minh) đến du lịch tâm linh ở Thới Bình, Phú Tân, Ngọc Hiển. Ông Võ Trường Giang, Chủ tịch UBND huyện Phú Tân vạch ý tưởng: “Chương trình này như sự “khởi nghiệp” phát triển du lịch cho từng địa phương. Phú Tân lợi thế ven biển với 6 cửa biển. Đặc biệt, Di tích căn cứ Tỉnh ủy Xẻo Đước (xã Phú Mỹ), Biệt khu Hải Yến Bình Hưng (xã Tân Hải), phục dựng một số điểm, kêu gọi đầu tư thành khu du lịch tâm linh, sẽ thu hút khách du lịch thập phương”.  Chủ tịch UBND tỉnh Lê Quân đề nghị, các địa phương rà soát đề xuất phát triển phong trào mỗi huyện một sự kiện để thu hút du khách đến trải nghiệm Bên cạnh thế mạnh, các địa phương cũng đặt ra không ít khó khăn cần tháo gỡ để chương trình này có thể phát triển sâu rộng, lâu dài. Đó là cần tạo thông thoáng về thủ tục quy định pháp luật để thu hút doanh nghiệp đầu tư. Chú trọng đầu tư, nâng cấp cơ sở hạ tầng, nối liền các khu du lịch các huyện liền kề để thu hút, níu chân du khách. Riêng địa bàn thành phố, thiết lập các city tour, kết nối các điểm du lịch tâm linh tại thành phố. Được biết, hiện nay Cà Mau xác định có 3 tuyến du lịch chính gồm: Cà Mau – Vườn Quốc gia U Minh Hạ - Hòn Đá Bạc; Cà Mau – Khu du lịch sinh thái Sông Trẹm; Cà Mau – Khu du lịch Mũi Cà Mau. Với 10 doanh nghiệp kinh doanh lữ hành, 83 cơ sở lưu trú du lịch với trên 2.600 phòng; 19 khu, điểm du lịch. Trong đó, có 14 điểm du lịch cộng đồng nhưng vẫn chưa khai thác hết tiềm năng, thế mạnh du lịch của địa phương. Tại hội nghị, các địa phương, công ty du lịch cũng nhìn nhận khó khăn, năng lực tổ chức du lịch, các dịch vụ đi kèm còn nhiều hạn chế, thiếu tự tin. Sản phẩm dịch vụ du lịch vẫn còn thiếu, chưa có nhiều chương trình, tour tuyến để đưa vào lịch trình ưu tiên khi du khách đến với Cà Mau.  Du lịch Cà Mau nhiều năm qua có bước phát triển nhưng còn rời rạc, chưa phát huy hết tiềm năng Đánh giá về vấn đề này, Chủ tịch UBND tỉnh Lê Quân đề nghị, các huyện, thành phố rà soát đề xuất phát triển phong trào mỗi huyện một sự kiện, hình thành những ý tưởng tốt, truyền thông kết nối để thu hút du khách đến trải nghiệm. Sở VHTT&DL sớm tham mưu trình kế hoạch xây dựng Chương trình ""Cà Mau điểm đến năm 2021"", để làm sao du khách có thể cảm nhận được những điều người ta mong muốn về sinh thái, lịch sử, văn hóa, ẩm thực, tâm linh ở Cà Mau. Để làm tốt điều này, vai trò các huyện, chính quyền địa phương rất quan trọng, đòi hỏi suy nghĩ sáng tạo, tạo nền tảng thu hút khách du lịch, xã hội hóa nhiều hơn. Theo đó, Sở Công thương cùng với Trung tâm xúc tiến thương mại hình thành cửa hàng giới thiệu sản phẩm, bán sản phẩm, ki ốt di động thiết kế đẹp, đặt nhiều nơi trên các tour, tuyến đường, trưng bày đặc sản đặc trưng địa phương. Đặc biệt, quy hoạch không gian tổ chức văn hóa nghệ thuật buổi tối. Hơn hết, tăng cường kết nối truyền thông du lịch trong và ngoài tỉnh, từng bước phát triển thương hiệu du lịch Cà Mau có sức cạnh tranh so với khu vực và cả nước./. Hồng Nhung      ","Từ phát triển du lịch sinh thái , gác kèo ong ( U Minh ) du lịch tâm linh Thới Bình , Phú Tân , Ngọc Hiển . Đặc biệt , Di tích Tỉnh ủy Xẻo Đước ( xã Phú Mỹ ) , Biệt khu Hải Yến Bình Hưng ( xã Tân Hải ) , phục dựng , kêu gọi đầu tư thành khu du lịch tâm linh , thu hút du lịch thập phương ” . Chủ tịch UBND tỉnh Lê Quân đề nghị , địa phương rà soát đề xuất phát triển phong trào huyện kiện thu hút du trải nghiệm Bên cạnh , địa phương khăn tháo gỡ chương trình thể phát triển sâu rộng , . Được , hiện Cà Mau xác định 3 tuyến du lịch : Cà Mau – Vườn Quốc gia U Minh Hạ - Hòn Đá Bạc ; Cà Mau – Khu du lịch sinh thái Sông Trẹm ; Cà Mau – Khu du lịch Mũi Cà Mau . Sản phẩm dịch vụ du lịch , chương trình , tour tuyến lịch trình ưu tiên du Cà Mau . Du lịch Cà Mau phát triển rời rạc , phát huy tiềm năng Đánh giá vấn đề , Chủ tịch UBND tỉnh Lê Quân đề nghị , huyện , thành phố rà soát đề xuất phát triển phong trào huyện kiện , hình thành tưởng , truyền thông kết nối thu hút du trải nghiệm . Hơn , cường kết nối truyền thông du lịch tỉnh , phát triển thương hiệu du lịch Cà Mau sức cạnh tranh khu vực nước./ ."
33,Đội Phần Lan đoạt ngôi vô địch lễ hội Pháo hoa quốc tế Đà Nẵng,06 tháng 07 2019 23:41,"(CMO) Đêm 6/7, sau màn biểu diễn hoành tráng, đội pháo hoa JoHo Pyro Professional Fireworks AB đến từ Phần Lan đã đoạt giải Nhất tại lễ hội Pháo hoa quốc tế Đà Nẵng 2019."," Với màn trình diễn độc đáo, đội đến từ Phần Lan đã đoạt cúp vô địch năm 2019. Đêm chung kết được khép lại bằng những màn bắn pháo hoa nghệ thuật mãn nhãn. Đội đến từ Phần Lan sử dụng cả nhạc truyền thống quê hương và lồng ghép vào đó bài hát nổi tiếng của Việt Nam, tạo sự giao thoa nghệ thuật lan tỏa hài hòa. Nhà vô địch địch lễ hội Pháo hoa quốc tế Đà Nẵng 2019 đã vinh dự nhận cúp và phần thưởng 10.000 USD. Bày tỏ niềm vui trong lần đầu tham dự lễ hội, ông Johan Hollander, Đội trưởng đội pháo hoa Phần Lan cho hay: đây là kỷ niệm khó quên của đội và thắp lên niềm hy vọng bằng cơ hội quay trở lại Đà Nẵng vào những năm sau. Như vậy, sau hơn 1 tháng diễn ra với 5 đêm trình diễn, lễ hội Pháo hoa quốc tế Đà Nẵng 2019 đã tìm được nhà vô địch mới. Hơn 17.000 khán giả trong và ngoài nước đã đến xem và cỗ vũ cho trận chung kết. Qua 10 kỳ tổ chức, lễ hội Pháo hoa quốc tế Đà Nẵng đã có những bước tiến đáng kể về quy mô, hình thức và chất lượng nghệ thuật, trở thành ngày hội sôi động của người dân trong nước và du khách nước ngoài. Lễ hội năm nay với chủ đề “Những dòng sông kể chuyện” đã thu hút 8 đội tham dự: Việt Nam, Brazil, Bỉ, Phần Lan, Ý, Anh và Trung Quốc. Qua 10 kỳ tổ chức, từ một sản phẩm du lịch, TP. Đà Nẵng đã nỗ lực phát triển không ngừng để trở thành một lễ hội du lịch quốc tế hàng đầu khu vực. Theo sở VH-TT&DL Đà Nẵng, trong hơn một tháng diễn ra lễ hội Pháo hoa quốc tế 2019, lượng khách đến xem và lưu trú trên địa bàn thành phố đạt khoảng 116.433 lượt, tăng 11% so với năm 2018. Chủ tịch tâp đoàn Sun Group khu vực miền Trung, đơn đăng cai tổ chức lễ hội cho hay, tổng chi phí cho lễ hội năm nay gần 140 tỉ đồng. Tổng vé bán ra cho du khách xem pháo hoa đạt 79.329 vé, doanh thu khoảng 12 tỷ đồng. Phong Phú ","Nhà vô địch địch lễ hội Pháo hoa quốc tế Đà Nẵng 2019 vinh dự cúp thưởng 10.000 USD . Bày tỏ niềm vui đầu tham dự lễ hội , Johan Hollander , Đội trưởng đội pháo hoa Phần Lan : kỷ niệm quên đội thắp niềm hy vọng hội trở Đà Nẵng . Như , 1 diễn 5 đêm trình diễn , lễ hội Pháo hoa quốc tế Đà Nẵng 2019 vô địch . Qua 10 kỳ tổ chức , lễ hội Pháo hoa quốc tế Đà Nẵng tiến quy mô , hình thức chất nghệ thuật , trở thành hội sôi động dân du . Đà Nẵng nỗ lực phát triển ngừng trở thành lễ hội du lịch quốc tế hàng đầu khu vực . Theo sở VH-TT & DL Đà Nẵng , diễn lễ hội Pháo hoa quốc tế 2019 , lưu trú địa bàn thành phố 116.433 lượt , 11 % 2018 . Chủ tịch tâp đoàn Sun Group khu vực miền Trung , đơn đăng cai tổ chức lễ hội , tổng chi phí lễ hội 140 tỉ đồng ."
34,Lễ hội Nghinh Ông Nét đẹp của ngư dân miền biển,24 tháng 03 2016 18:34,"Thị trấn Sông Ðốc vừa diễn ra Lễ hội Nghinh Ông. Những ngày lễ hội, dưới sông, hàng ngàn tàu bè lớn, nhỏ, tấp nập kẻ mua người bán; trên bờ, những dòng người chen nhau, tay bắt, mặt mừng thăm hỏi chuyện làm ăn.","Thị trấn Sông Ðốc vừa diễn ra Lễ hội Nghinh Ông. Những ngày lễ hội, dưới sông, hàng ngàn tàu bè lớn, nhỏ, tấp nập kẻ mua người bán; trên bờ, những dòng người chen nhau, tay bắt, mặt mừng thăm hỏi chuyện làm ăn. Lễ hội Nghinh Ông năm nay diễn ra trong 4 ngày (từ 13-16/2 âm lịch, 21-24/3 dương lịch) với các hoạt động: đờn ca tài tử Nam Bộ, ca múa nhạc, hội chợ du lịch - thương mại, hội thao với các trò chơi dân gian… Trong chuỗi hoạt động của Lễ hội Nghinh Ông, Sở NN&PTNT cùng với chính quyền địa phương thị trấn Sông Ðốc, huyện Trần Văn Thời tiến hành thả 400.000 con tôm thẻ, tôm sú và 20.000 con cá chẽm xuống biển nhằm góp phần tái tạo nguồn lợi thuỷ sản và giáo dục cộng đồng về ý thức khai thác, bảo vệ và phát triển nguồn tài nguyên biển. Lễ hội Nghinh Ông là hoạt động truyền thống của ngư dân yêu nghề biển, mang đậm sắc thái văn hoá dân tộc, tạo sự gắn kết giữa các thương nhân kinh doanh dịch vụ hậu cần nghề biển với người đánh bắt xa bờ; tăng cường đoàn kết, giúp đỡ nhau về vốn sản xuất, chia sẻ kinh nghiệm trên ngư trường và quyết tâm bảo vệ  chủ quyền biên giới biển, đảo./. Hàng trăm tàu cá từ các nơi khai thác trên ngư trường Cà Mau tham gia hộ tống ông Nam Hải ra biển. Thanh Quang thực hiện","Lễ hội Nghinh Ông diễn 4 ( 13-16/2 âm lịch , 21-24/3 dương lịch ) hoạt động : đờn ca tài tử Nam Bộ , ca múa nhạc , hội chợ du lịch - thương mại , hội thao trò dân gian… Trong chuỗi hoạt động Lễ hội Nghinh Ông , Sở NN & PTNT quyền địa phương thị trấn Sông Ðốc , huyện Trần Văn Thời tiến hành thả 400.000 tôm thẻ , tôm sú 20.000 cá chẽm biển góp tái lợi thuỷ sản giáo dục cộng đồng thức khai thác , bảo vệ phát triển tài nguyên biển . Lễ hội Nghinh Ông hoạt động truyền thống ngư dân yêu nghề biển , đậm sắc thái văn hoá dân tộc , gắn kết thương nhân kinh doanh dịch vụ hậu nghề biển đánh bắt bờ ; cường đoàn kết , giúp đỡ vốn sản xuất , chia sẻ kinh nghiệm ngư trường quyết tâm bảo vệ chủ quyền biên giới biển , đảo./ ."
